THE DIGITAL BRICKS,2021,"Australia, Melbourne",If These Walls Could Talk...,"['#Australia', '#2021', '#Animated Architecture']",https://awards.b-cdn.net/site_media/media/jurysys/media/222/6_big_NTNs49z.jpg,https://awards.mediaarchitecture.org/mab/project/222,"The University of Melbourne, Melbourne Connect",Woods Bagot,"Science Gallery Melbourne, Arup",Arup,Arup,AVIT Integration,"REELIZE.STUDIO, Light-Ctrl, Science Gallery Melbourne",AVIT Integration,"REELIZE.STUDIO, Light-Ctrl","REELIZE.STUDIO, Light-Ctrl","Individual glass bricks on the facade's exterior serve as lenses for LED screens housed within the wall cavity. The glass bricks are integrated into the traditional handset brickwork faíçade at the entrance to the precinct. Technical features include continuity of the thermal insulation to achieve GreenStar rating, thermal and structural compatibility of clay and glass bricks, and cavity access to maintain LED screens and connections.","The glass bricks provide remarkable optical properties of their own, which were embraced as part of the project design. Due to their offset installation, glass bricks provide a prismatic effect, effectively obscuring views onto the lit screens at certain viewing angles. Second, reflection and refraction of the glass bricks give the screens a magical, mesmerising, pseudo-holographic effect when viewed from different angles. As the screens broadcast content, the soft glow that emanates from the wall is so unexpected that one is compelled to look right up close and into them and explore the stories that this wall tells.","226 polished glass bricks, each illuminated by a bespoke rear-mounted high-definition LED screen in a custom-fabricated enclosure. Individual LED screens have a resolution of 1,280 by 720 pixels, effectively delivering a complete digital canvas totalling 208,281,600 active pixels. Once spatialized to accommodate faíçade scale and brick layout, content is rendered at a resolution equal to approximately 845,447,418 megapixels.","Melbourne Connect is situated in the Melbourne suburb of Carlton, immediately adjoining Melbourne's Central Business District. The area is known for its 19th-century Victorian architecture, garden squares, and the University of Melbourne's main Parkville campus across Swanston Street. Melbourne Connect is built on the site of the former Royal Women's Hospital in Melbourne. The site carries enormous local significance as many Melburnians have connections to the site through family and friends' births. The site also fulfilled an instrumental role in enabling medical innovation as part of the University of Melbourne's research in medicine and health sciences since the early 1900s. The newly developed innovation precinct provides office space to academics in various faculties and schools, with the Faculty of Engineering and Information Technology being the primary tenant.","The faíçade's debut content centres around First Peoples knowledge. The content brings to life photographs of several thousand artefacts from the University's cultural collections of Indigenous significance and reflecting scientific innovation in the fields of engineering, medicine and biological sciences. Photographs are algorithmically manipulated, such as by way of neural style transfer to create visual connections between disparate image collections and instil a sense of intrigue and ambiguity among onlookers. Reflective of traditional smoking ceremonies, vapour animations overlay the visualisation and create a warming and healing environment.","Niels Wouters, Niels Wouters, Toby Welch, Peter Casamento, Toby Welch, Niels Wouters, Lachlan Outhred, Paul Burston",Lendlease,The University of Melbourne,,Body Politic,,,,,,The University of Melbourne,"Woods Bagot, Arup",Byrne Construction Systems,,,,"Each LED screen is capable of delivering 1,500 nits at a maximum energy draw of 25W. At this luminance level, the installation is viewable both during the daytime and at night. Light sensors external to the installation allow for real-time adjustments of screen luminance in response to ambient light levels.",
LA SPRITE,2019,"France, Le Havre",Artificial supernatural light creature,"['#France', '#2019', '#Spatial media art', '#More than Human Architecture']",https://awards.b-cdn.net/site_media/media/jurysys/media/248/1_big.jpg,https://awards.mediaarchitecture.org/mab/project/248,"EDF, Festival Un Ete au Havre",,Antoine Schmitt,,,,Antoine Schmitt,,Pharos,Antoine Schmitt,"2 chimneys, 240m high",Programmed generative and interactive movement.,2 times 18 x 30 pixels,"The EDF electrical power plant is located in the industrial port area of Le Havre (first container port of France, 11th of Europe). The chimneys are a landmark of the city. They are visible from 50km around, especially from the downtown of the city of Le Havre.",The video documents various moments of La Sprite's movements.,"Antoine Schmitt, Antoine Schmitt, Antoine Schmitt, Antoine Schmitt, Antoine Schmitt, Antoine Schmitt, Hortense Gauthier",Charles Carcopino and Festival Un Ete au Havre,,"The Un Ete au Havre Festival maintains a strong connection with the inhabitants of the city of Le Havre and created many mediation events around the artworks, especially La Sprite.",Temporary artwork,"non-human point of view, human-nature relationship, architecture as other species habitat","The artwork La Sprite seems to have made a strong imaginary effect on the inhabitants of the city of Le Havre, according to the many feedbacks that I have received. People seem to have had a very personal and intimate relationship with the creature of La Sprite.","Specific software program to fetch meteorological data an control the Pharos Led controler. This program was also accessible remotely, for debuging and special events purposes without the need to go on site.",Pharos controler,,Festival Un Ete Au Havre,,,,,1m,,
PASSAGES,2019,"France, Toulouse","A permanent videoconference network in public spaces. People, dancers or artists can communicate through Passages, in real time and life-sized proportions.","['#France', '#2019', '#Participatory Media Architecture and Infrastructures']",https://awards.b-cdn.net/site_media/media/jurysys/media/11/0_big.jpg,https://awards.mediaarchitecture.org/mab/project/11,Guillaume Ajavon,,Guillaume Ajavon,Mikaí«l Gramont & Franíçois de Rochebrune,,Patrice Atchy Dalama,,Patrice Atchy Dalama,,Franíçois de Rochebrune,Preexisting glass wall visible from public space. Rectangle : 2.2m high x 3.9m large (16:9),"Ultra bright LED Screen to have an immersive experience, to be with ""the others"".","1080p, no delay of transmission.",Center of Toulouse and center of Montreal.,"1 month of communication between the 2 cities. 24/7, free, all the people passing by can interact.","Pablo Garcia, Pablo Garcia",Agnes Domingo,Etoie Dií¨se Company,"Fablabs are the ""gate keepers"" Deaf communities teach to hearing people sign language. Artist, designers and dancers involved to test the Passages.","Association (Non lucrative organisation, 1901 law)","Interaction between distant people. Interaction between deaf and hearing people Geopolitic (will China or Emirates, for example, accept to open a Passage) ? Can a rich north country be daily visible by a city in Africa ? How people will react ? Make the digital communication devices disappear. Take the Internet out of the private or professional sphere.",Thousands of people. In each city.,App to control and connect Passages and destinations.,"creativity, videoprojector, camera, glasspaper, WEBRTC technology, servers",Deploy 10 Passages across the globe. Make them switch once a day. Develop web radio (to bring the sound via smartphones) and digital writing (a form of daylight painting).,,,,,,,,
ARCHIVE DREAMING,2017,"Turkey, ISTANBUL",ARCHIVE DREAMING,"['#Turkey', '#2017', '#Spatial media art', '#Animated Architecture']",https://awards.b-cdn.net/site_media/media/jurysys/media/13/0_big.jpg,https://awards.mediaarchitecture.org/mab/project/13,REFIK ANADOL,REFIK ANADOL & RAMAN K. MUSTAFA,REFIK ANADOL,SALT,REFIK ANADOL STUDIO,REFIK ANADOL STUDIO,REFIK ANADOL STUDIO,REFIK ANADOL STUDIO,REFIK ANADOL STUDIO,REFIK ANADOL STUDIO,,LASER PROJECTION TECHNOLOGY. 12K LUMINANCE X 4 CHANNEL USING CUSTOM SOFTWARE FOR EDGE BLENDING,6200 X 1200PX,TEMPORARY MEDIA ART INSTALLATION IN A PUBLIC RESEARCH LIBRARY,DOCUMENTATION OF THE EXPERIENCE,"Refik Anadol, Refik Anadol, Refik Anadol, Refik Anadol, Refik Anadol",GOOGLE AMI,SALT,"Public Archive Researchers, students, phd students, archivists, architectural urban researchers, history researchers, designers, media artists, artists, teachers, academicians,",,"What are the urgent conditions, responsibilities, meanings and futureÂ­directed objectives for a cultural institution functioning in the 'future' year 2017? By attempting to consider these concerns along with questions of efficiency, ecology and sustainability, SALT's 2017 program provisionally titled What If...? will be composed of a series of changes to internal working practices, accompanied by five artistic interventions/architectural gestures that reconsider, reinvigorate the spaces, the ambitions and the constituent relations within SALT Galata. The question being: What if... we implement a range of changes within the institution that introduce ideas we often talk about but that seem too extraordinary, too spatially absurd, too virtual or quite the oppositeÂ­ too practical Â­ to be considered exhibition programming. What if... we imagine 2017 is the future?",40.000 PEOPLE VISITED. MORE OF THE VISITORS ARE RESEARCHER WITH PHD DEGREE TO ENHANCE THEIR COGNITION ON SEVERAL CULTURAL RESEARCH AREA MACHINE LEARNING ALGORITHMS HELPED US TO EXPLORE THIS INVISIBLE UNIVERSE OF ARCHIVE AND REVEALED MANY UNIQUE RELATIONSHIPS,CUSTOM MACHINE LEARNING ALGORITHMS CUSTOM SOFTWARE FOR LOADING MILLIONS OF IMAGES CUSTOM SOFTWARE FOR INTERACTION WITH DATA UNIVERSE,MACHINE LEARNING ALGORITHMS CUSTOM SOFTWARE DIGITAL ARCHIVE MANAGEMENT METADATA MANAGEMENT,VR INSTALLATION TO BRING BOTH PHYSICAL AND VIRTUAL WORLDS OF ARCHIVE TOGETHER,SALT,SALT,SALT,SALT,,,,
NORTHSIDE BEACONS,2018,"Denmark, Aarhus",EXPERIENCE-BASED NUDGING,"['#Denmark', '#2018', '#Spatial media art', '#Participatory Media Architecture and Infrastructures']",https://awards.b-cdn.net/site_media/media/jurysys/media/14/0_big.jpg,https://awards.mediaarchitecture.org/mab/project/14,Down the Drain Production / Northside Festival,Down the Drain Production / Kollision,Kollision / Down the Drain Production,n/a,Kollision,Kollision / Martin by Harman,Kollision,Martin by Harman,Kollision,Kollision,,,,,,"Photo by Allan Toft, Photo by Allan Toft, Photo by Allan Toft, Photo by Allan Toft, Movie by Allan Toft",Kollision / Down the Drain Production / Martin by Harman,Martin by Harman,Festival-goers at Northside 2018.,n/a,Using experience design as a reward to get users to deposit recyclable trash into specific stations instead of leaving it on the ground or putting it into normal trash cans.,"It was a prototypical setup involving just one station, so this years impact was relatively small. We're working on a larger scale implementation for next year's festival.",Bespoke sensors and sensor integration with Kollisions MAP-software (Media Architecture Platform).,MAP - Media Architecture Platform.,Developing a more integrated system for promoting a circular approach to waste collection at Northside 2019.,Northside 2018 / Down the Drain Production,n/a,n/a,n/a,n/a,,,
LIGHTSPELL,2017,"Canada, Toronto","Permanent, interactive, light installation at the new Pioneer Village subway, in Toronto, Canada","['#Canada', '#2017', '#Spatial media art', '#Participatory Media Architecture and Infrastructures']",https://awards.b-cdn.net/site_media/media/jurysys/media/15/0_big.jpg,https://awards.mediaarchitecture.org/mab/project/15,Toronto Transit Commission (TTC),Design Architect: Will Alsop (aLL Design); Project Architect: IBI Group,realities:united,,realities:united,Go Lighting / Christie Lites,Interactive/Public,Go Lighting / Christie Lites,"realities:united, Christian Riekoff",realities:united,Facade Type: not applicable Geometry of sculpture: undulating band,LED (white),40 customised chandeliers with 16 pixels (segments) each; 640 pixels total resolution,"public subway station, platform level",not applicable,"Â© realities:united, Â© realities:united, Â© realities:united, Â© realities:united, Â© realities:united","Ian Trites, Toronto Transit Commission (TTC)",,"Following a selection process for public art for the Pioneer Village Station, realities:united were selected as public artists by the ""Pioneer Village Station Art Design Review Committee"" (ADRC). All stakeholders, such as the nearby York University and the TTC (Toronto Transit Commission), were involved in the process of developing the artwork. Furthermore, a Public House Event was organized to discuss the artwork and to answer all questions from the public. Since the censorship of LightSpell in December 2017 (for more information on this please see 39 - Comments) a broad social discourse about freedom of expression in public space has evolved and is still ongoing in regional and national press and social media.",not applicable,"Besides practical issues about form, design and interpretation of LightSpell, there was a lively and controversial discussion about the topics of free speech and freedom of expression. Another issue was the general duty and function of state-owned associations. What do they have to provide? What are their liabilities? etc.",The outcome of these discussions has been integrated in the client's and realities:united's working process.,not applicable,not applicable,not applicable,"TTC (Toronto Transit Commission), York University Toronto",,,,,not applicable,,
LIGHTLINES,2018,"Australia, Buranda, Brisbane",Lightlines: a site-responsive kinetic and lighting artwork,"['#Australia', '#2018', '#Participatory Media Architecture and Infrastructures']",https://awards.b-cdn.net/site_media/media/jurysys/media/21/0_big.jpg,https://awards.mediaarchitecture.org/mab/project/21,Wee Hur (Buranda TOD) / davisthomas built the artwork,,davisthomas,Ian Barnes,davisthomas,albert smith group,davisthomas,albert smith group,albert smith group,,"The lighting is built into the physical artwork - using small channels to reflect the light up and out into the local environment. The artwork is made up of: 316 electro-polished stainless steel elements, GFRC Concrete, mild steel, IP65 rated LED RGB, DMX lighting controllers. Dimensions: 12000mm x 4000mm x 4000mm","The lighting is a subtle & integral part of the visual nighttime experience. Bringing the audience to the ideas of time, timetables, journies. Working in a clockwise rotation the lighting design slowly brings up each route (one at a time) to its full light - holds for 5 minutes & then cross transitions to the next route, thus creating a 30min full rotation clock.","Starting from dusk, each route of the artwork is lit up for a 5 minute period then crossfaded to the next in a clockwise fashion. The lux levels are in keeping with the broader lighting design to be visually present but not overtly impactful. The idea is for cafe/bar patrons to use the work to keep a sense of time, in combination with catching transport at the stations.","The artwork is situated in an Urban Village development with 32 story multi-use residential, retail and transport hub. Buranda is in an inner-suburb of Brisbane City.",please see images of the work at: http://davisthomas.com.au/works/public-commissions/lightlines,"davisthomas, Lightlines, 2018., davisthomas, Lightlines, 2018., davisthomas, Lightlines, 2018., davisthomas, Lightlines, 2018., davisthomas, Lightlines, 2018., davisthomas, Lightlines, 2018.",davisthomas,,"The work did not involve community engagement as there is no current community at the location. However, the research and subsequent work reflects the social and geological histories of the location. Additionally, Queensland University Technolgy students were invited to explore our unique large-scale practice studio as part of their learning opportunities.",,"How do we create a sense of place - a micro identity for an urban village within the context of a larger city landscape? and equally, how do we generate a sense of Place out of greenfield development?","By highlighting the rich layers of location history of this 'greenfield' site, the project is a start point in community-led identity creation. Through designing a unique site-responsive artwork for Buranda, we hope to support the Urban Village Development to generate its own sense of Place.",,,The work is located in Buranda for a 20year period.,davisthomas,,,davisthomas,,,,
KIPNES LANTERN,2017,"Canada, Ottawa",Rejuvenating Canada's National Arts Centre,"['#Canada', '#2017', '#Animated Architecture']",https://awards.b-cdn.net/site_media/media/jurysys/media/28/0_big.jpg,https://awards.mediaarchitecture.org/mab/project/28,"National Arts Centre, Ottawa",Diamond Schmitt Architects,Oneoverchaos/Alex Doss,Cleland Jardine Engineering,,ClearLED,Oneoverchaos/Alex Doss/Moment Factory,ClearLED,ClearLED,Moment Factory,"The Kipnes Lantern is shaped as a three-storey hexagonal glass tower, echoing the existing building's geometry.",,,"The Kipnes Lantern is intended to transform a mid-century Brutalist structure into a more open and inviting facility. The building had faced the Rideau Canal, rather than Ottawa's downtown core, ever since it opened in 1969. One of the goals of the renewal was to move the facility's front door to Elgin Street.","Moment Factory's content framework provides a unique platform for the venue to showcase content from partners across the country, while bringing the NAC's seasonal artistic program to life in an engaging and informative way. Images and videos are easily integrated and transformed into dynamic visuals highlighting NAC events and Canada's diversity of talent.","Moment Factory, Moment Factory, Moment Factory, ClearLED, Diamond Schmitt Architects, ClearLED",ClearLED,Dr. Dianne Kipnes and Mr. Irving Kipnes,"Ever since the opening of the Kipnes Lantern, the National Arts Centre has been using this new permanent installation to show off its spirit and community support. E.g., during October screens were designed to support World Mental Health Day and this support has been noticed and captured on multiple social media platforms. From fantastical stage designs to virtuosic animated performances, this digital media facade enables architecture to tell the evolving story of the arts in Canada.",,"The architecture of the new National Arts Centre building is uniquely shaped as a giant lantern. To light up the space, ClearLED was challenged with designing custom screens to fit the space precisely and deliver the maximum transparency and brightness. An additional hurdle was to ensure the components were lightweight, sturdy, and accessible for maintenance. The four blades had to be waterproof and withstand cold and wet Ottawa outdoor weather conditions.","Special content was developed to recognize events of national importance, including National Indigenous Peoples Day, Canada Day and Remembrance Day.",Content Management Interface,"Christie's Pandora Box Media Server, Novastar LED control software, Cinema 4D stage visualization, AutoCAD, SolidWorks, After Effects",Further develop the content management platform and allow the Lantern and the Light Blades are the true canvas for everyone. Inviting artists nationally and internationally to participate in the media facade creation.,,ClearLED,ClearLED,,,"16mm pixel pitch for the ""Lantern""; and 6mm pixel pitch for the ""Light Blades""",,
ARENA,2018,"Canada, Kitchener","interactive sound sculpture as ""Speakers Corner"" for people to express themselves in public spaces","['#Canada', '#2018', '#Future trends & prototypes', '#Participatory Media Architecture and Infrastructures']",https://awards.b-cdn.net/site_media/media/jurysys/media/33/0_big.jpg,https://awards.mediaarchitecture.org/mab/project/33,Benoit Maubrey,Jan Fuhrmann,Benoit Maubrey,"Rex Lingwood, Jago Whitehead",,,,,,Johnny Camara,Amphitheater structure,,,"public space / City Hall Kitchener, Canada",,"B. Maubrey, B. Maubrey, B. Maubrey, Lea Clarin, B. Maubrey",Gordon Hatt,"Cafka, Kitchener Canada","the public, local arts organizations, and social communities",,"public speech, recycling awareness",interaction of local communities,App for people to call up and express themselves in a public space,"Bluetooth, smart phones, amplifiers, 320 reycled loudspeakers, e-waste, cables, microphone.",further exhibition in other countries and cities,"Cafka, Kitchener Canada",,,,,,,
SALLING LIGHTS,2017,"Denmark, Aarhus & Aalborg",Interactive media facades,"['#Denmark', '#2017', '#Branded Architecture', '#Participatory Media Architecture and Infrastructures']",https://awards.b-cdn.net/site_media/media/jurysys/media/35/2_big.jpg,https://awards.mediaarchitecture.org/mab/project/35,Salling Group,C.F. Mí¸ller,Kollision Design Office,,Kollision Design Office,Kollision Design Office,,Martin by Harman,KOLLISION MAP,Kollision Design Office,"Linear, individually controllable LEDs mounted on existing facade.",Light emitting diodes,"Linear LEDs, mounted at varying intervals",Both facades are placed at main shopping streets / urban centers i Aarhus and Aalborg.,"Content is dynamic, interchangeable sometimes interactive, controlled by Kollision's MAP software (Media Architecture Platform).","Photo by Kollision Design Office, Photo by Kollision Design Office, Photo by Kollision Design Office, Movie by Kollision Design Office, Movie by Kollision Design Office",Kollision Design Office,Salling Fondene (Salling Foundation),The project was developed in close collaboration with the Municipality of Aarhus and Aalborg being the first of its kind in both cities. It was realised in close collaboration with the client and based on a participatory design process including citizens.,,"Retail shopping is moving in a direction towards being more experience oriented to compete with online shopping. The facade reflects the surrounding urban situation, events, weather etc. It is not used for commercial marketing in agreement with the local municipalities. At special events citizens are invited to e.g. draw on the facade, make statements through sms or engaging in simple games.","The facade provides and enhanced brand ambience for the respective shopping centers, effectively allowing them to communicate with their urban surroundings and promoting local events such as festivals and also make statements in relation to special occasions, e.g. national holidays, sports etc.",,MAP software (Media Architecture Platform),Continuous development of new content and interactive experiences for special occasions.,Salling Group,,,,,Varying,,
