NOVARTIS PAVILLON,2022,"Switzerland, Basel",Zero-energy media facade,"['#Switzerland', '#2022', '#Animated Architecture', '#Beyond Commercial Media Architecture']",https://awards.b-cdn.net/site_media/media/jurysys/media/294/6_big_0Ou4Ic7.jpg,https://awards.mediaarchitecture.org/mab/project/294,Novartis,AMDL CIRCLE and Michele De Lucchi,iart - studio for media architectures,form TL,iart - studio for media architectures,iart - studio for media architectures,"Daniel Canogar, Esther Hunziker, Semiconductor, curated by HEK (House of Electronic Arts)",iart - studio for media architectures,"iart AEPOS, TouchDesigner",iart - studio for media architectures,"The media facade consists of 10,000 diamond-shaped organic solar modules with 30'000 RGBW LEDs. They are mounted on a steel frame, which is attached to the sheet metal facade of the donut-shaped building. The solar modules facing outwards each have two embedded LED units, which are bi-directional in the sense that there is one LED pointing away from the facade and one pointing onto the facade. By combining power generation and light source, we created a zero-energy media facade. This means that the total amount of energy consumed by the facade over a year is (at least) equal to the amount of energy it produces itself.","Organic photovoltaics makes it possible to create media facades that meet both aesthetic and ecological requirements. Because they can be manufactured in a variety of shapes and sizes, are flexible, semi-transparent and extremely light sensitive, organic solar modules are ideal for a curved structure. They are also carbon-based, contain much less grey energy than silicon solar modules and are thus a good choice not only from a design point of view, but also from a sustainability perspective. At the Novartis Pavillon, the electricity generated by the organic solar cells is used to illuminate the building. The LEDs shine both outwards and in the direction of the metal shell beneath - causing their light to reflect and shimmer through the semi-transparent solar modules.","The total resolution of the facade is 240 x 126 px. Each LED forms one pixel and is controlled individually. Half of the LEDs face away from the building, half face towards the building.","The Novartis Pavillon is located in a park within the Novartis Campus in Basel, Switzerland. It is situated right next to the river Rhine and the bridge ""Dreirosenbrücke"". The zero-energy media facade acts as an interface between the inside and the outside, allowing the building to enter into a dialogue with the surrounding urban space. It turns the Novartis Pavillon into a luminous icon that is visible from many locations in Basel.","Every day after sunset, the facade shows the works of three international artists: Daniel Canogar, Esther Hunziker and Semiconductor. They collaborated with scientists to develop artworks inspired by the shapes and colours of cells and molecules, as well as the themes of sustainability and the convergence of art and science. During daytime, the facade displays moving text, using only the white LEDs that face away from the building.","Laurids Jensen, iart - studio for media architectures, Laurids Jensen, iart - studio for media architectures, Laurids Jensen, iart - studio for media architectures, iart - studio for media architectures, iart - studio for media architectures",iart - studio for media architectures,,,,,,,,,,iart - studio for media architectures / AMDL CIRCLE and Michele De Lucchi,iart - studio for media architectures,,iart - studio for media architectures,Pixel distance is approx. 56 cm.,"To keep both energy consumption and light pollution as low as possible, an algorithm was implemented to ensure that the facade is just bright enough for content to be visible. The luminous intensity is constantly adjusted based on the ambient light. The maximum luminance of the facade is 500 nits. The contrast ratio is dynamic, as the LEDs are bi-directional and controlled independently towards the front and back.",ASCA (organic photovoltaic modules)
LIGHT ART INSTALLATION BEACON,2019,Kyiv,"Beacon is a light art installation, based on a 60-meter factory pipe in the territory of the former motorcycle factory in Kyiv, where the first innovative park of Ukraine, UNIT.City.","['#2019', '#Spatial media art']",https://awards.b-cdn.net/site_media/media/jurysys/media/295/0_big.jpg,https://awards.mediaarchitecture.org/mab/project/295,UDP,"APA Wojciechowski, PL","Sebastian Kite, GB","Expolight, Ukraine","Mykola Kabluka, Expolight, Ukraine","Expolight, Ukraine",,"Expolight, Ukraine","Expolight, Ukraine","Expolight, Ukraine",Factory pipe 63m x 8m x 8m,"xenon searchlighting, LED, aluminium, steel, custom programming",,,,"Melnikov Oleh, Savchenko Yevhenii, Melnikov Oleh, Sebastian Kite, Savchenko Yevhenii, Melnikov Oleh, Sebastian Kite, Sebastian Kite, Savchenko Yevhenii, Melnikov Oleh","Nadim Samman, Darya Koltsova",,,,,,,,,UNIT.City,,,,,,,
ATMOSPHERIC SPACES,2021,"Germany, Weimar",vessel for distant and imaginary realities,"['#Germany', '#2021', '#Spatial media art']",https://awards.b-cdn.net/site_media/media/jurysys/media/296/0_big.jpg,https://awards.mediaarchitecture.org/mab/project/296,cgf,,,,,,,,,,,,,,"pictures, illustrations and technical drawings of the built immersive installation","cgf, cgf, cgf, cgf, cgf, cgf, cgf, cgf",,,,,,,,"Arduino, Processing, Raspberry Pi, Laser cuter",,,,,,,,,
STAR HUNTERS,2019,"Greece, Athens",An urban game to recreate the sky,"['#Greece', '#2019', '#Spatial media art', '#Participatory Media Architecture and Infrastructures']",https://awards.b-cdn.net/site_media/media/jurysys/media/297/1_big.jpg,https://awards.mediaarchitecture.org/mab/project/297,,,"Francine Dulong, Vitor Freire, Artemis Psaltoglou, Katerina Bakaliou, Juan Carlos Carvajal B.",,,,,,,"Francine Dulong, Vitor Freire, Artemis Psaltoglou, Katerina Bakaliou, Juan Carlos Carvajal B.",,,,The game is designed to be played in public spaces and involve the audience into the start hunting.,,"Team Members, Team Members, Team Members, Team Members, Team Members",,Trust in Play,,,,,,,,,,,,,,,
CATHOLIC СHURCH OF ST. NICHOLAS,2019,"Ukraine, Kyiv",The Catholic church of St. Nicholas in Kyiv is a piece of architectural heritage,"['#Ukraine', '#2019', '#Animated Architecture']",https://awards.b-cdn.net/site_media/media/jurysys/media/298/0_big.jpg,https://awards.mediaarchitecture.org/mab/project/298,"MacPaw, Ring Ukraine, SD Capital, Toronto-Kyiv",,"Mykola Kabluka, Ukraine","Expolight, Ukraine","Mykola Kabluka, Expolight, Ukraine","Expolight, Ukraine",,"Expolight, Ukraine","Expolight, Ukraine",,Historical facade of architectural heritage,,,The Church of St. Nicholas is located in the center of Kyiv.,,"Andrii Bezuglov, Andrii Bezuglov, Andrii Bezuglov, Andrii Bezuglov, Andrii Bezuglov, Andrii Bezuglov, Savchenko Yevhenii, Melnikov Oleh",,"MacPaw, Ring Ukraine, SD Capital, Toronto-Kyiv",,,,,,,,Latin Church in Ukraine (LCiU),,,,,,,
OPTICAL FOOTPRINT,2021,"Germany, Weimar",Immersive experience in negative after-images,"['#Germany', '#2021', '#Spatial media art']",https://awards.b-cdn.net/site_media/media/jurysys/media/299/3_big.jpg,https://awards.mediaarchitecture.org/mab/project/299,,,,,,,,,"Resolume, Arduino",,,,,,,"Chanadda Janthivanont, Chanadda Janthivanont, Chanadda Janthivanont, Chanadda Janthivanont, Chanadda Janthivanont, Chanadda Janthivanont",,,,,,,,,,,,,,,,,
SPECTATOR AND SPECTACLE,2021,"France, Paris",Architecture's role as the opposing force,"['#France', '#2021', '#Future trends & prototypes', '#Participatory Media Architecture and Infrastructures']",https://awards.b-cdn.net/site_media/media/jurysys/media/300/0_big.jpg,https://awards.mediaarchitecture.org/mab/project/300,Delaney Inamine,Delaney Inamine,Delaney Inamine,Delaney Inamine,,,,,,,"This project proposes an infrastructure that climbs up the height of the Haussmannian facades - allowing for inhabitants and the public to build upon the scaffolding to create networks, social spaces and extensions of their public and private lives. The project develops and shifts over time according to the needs of the inhabitants and the community at large. The North and South facades would be developed differently according to the level of sunlight. The North Facade would use more transparent materials and would leave space between the windows and the platforms to allow for sunlight whereas the South facing facade - which receives more direct light - wouldn't require this.",,,"The proposal requires the restructuring of real estate practice in Paris. Property laws would shift to allow for the purchase of air space, rather than just square footage on the ground. Air space would be parceled out to allow for development on top of and between buildings. The project also has a major effect on the street - allowing for additional dining, commercial and circulation space. The level of community is brought up to the levels we live on.","This pandemic will end. We will adapt the way we communicate, connect and circulate once again. But, the need for a solidified new network of connection will still be necessary. We must rethink our use of the ground - shouldn't we allow retail, dining and public activities to take over our the street level? What if we created a new network of social traffic above the street level - connecting friends, families and activities. This physical, very tactile connection combats the virtual space we find ourselves in today. Can we formalize the informal social networks we create?","Delaney Inamine, Delaney Inamine, Delaney Inamine, Delaney Inamine, Delaney Inamine, Delaney Inamine, Delaney Inamine, Delaney Inamine",,,,,"The infrastructure allows for different patterns of development based on many factors: The needs of inhabitants The need for community space, similar to parks The need for shade or light The need for an extension of an apartment The need for commercial or dining space etc. The process of building and deciding what is important to the community is as important as the end result. The nature of this project is ever-changing to fit the needs of the ever-changing inhabitants between the buildings.",,,,,,,,,,,,
INTERACTIVE MEDIA SCULPTURE THE CUBE,2019,"Ukraine, Kyiv",The first massive media sculpture in Ukraine and Europe that are show the invisible rhythm of the city on its screen using digital content,"['#Ukraine', '#2019', '#Spatial media art']",https://awards.b-cdn.net/site_media/media/jurysys/media/301/1_big.jpg,https://awards.mediaarchitecture.org/mab/project/301,Saga Development,,"Mykola Kabluka, Ukraine","Expolight, Ukraine","Mykola Kabluka, Expolight, Ukraine","Expolight, Ukraine","Expolight, Ukraine","Expolight, Ukraine","Expolight, Ukraine","Expolight, Ukraine",,LED screens,,,,"Ivan Avdeenko, Ivan Avdeenko, Ivan Avdeenko, Ivan Avdeenko, Ivan Avdeenko, Ivan Avdeenko, Savchenko Yevhenii, Melnikov Oleh",,,,,,,,,,Saga Development,,,,,,,
LIGHTING FOR THE TETRIS HALL RESIDENTIAL COMPLEX,2019,"Ukraine, Kyiv",Media facades working as one system,"['#Ukraine', '#2019', '#Animated Architecture']",https://awards.b-cdn.net/site_media/media/jurysys/media/302/1_big.jpg,https://awards.mediaarchitecture.org/mab/project/302,KAN Development,A. Pashenko Architects,"Mykola Kabluka, Ukraine",,"Mykola Kabluka, Expolight, Ukraine","Expolight, Ukraine","Expolight, Ukraine","Expolight, Ukraine","Expolight, Ukraine","Expolight, Ukraine",,,,,,"Oleh Stelmakh, Savchenko Yevhenii, Melnikov Oleh, Savchenko Yevhenii, Melnikov Oleh, Savchenko Yevhenii, Melnikov Oleh, Savchenko Yevhenii, Melnikov Oleh, Savchenko Yevhenii, Melnikov Oleh",,,,,,,,,,KAN Development,,,,,,,
ALL COLORS ARE IN THE LIGHTS,2019,"Taiwan, Taichung",Extracting and Overlaying Urban Images for Interactive Spatiality,"['#Taiwan', '#2019', '#Spatial media art']",https://awards.b-cdn.net/site_media/media/jurysys/media/303/2_big.jpg,https://awards.mediaarchitecture.org/mab/project/303,National Taichung Theater,"Toyo Ito & Associates, Architects","Tien Ling, Ling Lee, I-Jon Hsieh",None,None,None,"Tien Ling, Ling Lee, I-Jon Hsieh",None,None,None,"All Colors Are In The Lights (ACAITL) is a 12-channel site-specific projection installation project in the gallery space inside the National Taichung Theater. Since its inauguration in 2016, the theater (designed by Japanese architect Toyo Ito) has been an important architectural landmark and popular destination for the public in the city of Taichung, Taiwan. The unusual building -- continuous curved concrete structure, changing between 3D convex and concave geometry, forming floors, walls, and ceilings at the same time -- creates an organic cave-like interior connection of spaces that makes ever-changing but always striking spatial impressions.",,,"In ACAITL, the common urban experience of commuting with the traffic on Taiwan boulevard is captured in a similar way as Google Street View, while a continuous panoramic perception is sampled into a series of stop-frame images, to be compiled later into an animation series that occupies the same time as the actual travel. The aim is to represent a recognizable perception of urban movement, while defamiliarizing the visuals in order to isolate and condense the sense of a steady flow of space. In dialogue to the term ""moving images"", the work aims to create the experience of ""moving through images"".","The imagery in ACAITL represents the selective mechanism in terms of perceiving and conceiving urban spatial information through a five-step procedure: Documentation: A series of panoramic shots are taken to represent the cityscape. Interpretation: The visual information in each frame is identified in four groups. Coding: A coding pattern is set to separate the original full-color photos into two / three images, with contrasting colors of visual elements to create overlapping addition of lights. Projection: Multiple projectors are arranged to overlay the images together to reconstruct the original view. The additive color model matches up primary and secondary colors into white. Interaction: When stepping in front of the white images, instead of casting shadows for lack of light, one reveals colorful shadows depicting urban elements and scenes.","Tien Ling, Ling Lee, I-Jon Hsieh, Tien Ling, Ling Lee, I-Jon Hsieh, Tien Ling, Ling Lee, I-Jon Hsieh, Tien Ling, Ling Lee, I-Jon Hsieh, photograph of Pi-Tzu Liu, Tien Ling, Ling Lee, I-Jon Hsieh, photograph of Pi-Tzu Liu, Tien Ling, Ling Lee, I-Jon Hsieh, photograph of Pi-Tzu Liu, Tien Ling, Ling Lee, I-Jon Hsieh, photograph of Pi-Tzu Liu, Tien Ling, Ling Lee, I-Jon Hsieh, Tien Ling, Ling Lee, I-Jon Hsieh",None,National Taichung Theater,,,,,,,,,None,None,none,None,,,None
THE 4TH STREET SW UNDERPASS ENHANCEMENT PROJECT,2019,"Canada, Calgary",An inner-city underpass reclaimed for public dialogue,"['#Canada', '#2019', '#Spatial media art', '#Participatory Media Architecture and Infrastructures']",https://awards.b-cdn.net/site_media/media/jurysys/media/305/0_big.jpg,https://awards.mediaarchitecture.org/mab/project/305,The City of Calgary,the marc boutin architectural collaborative inc.,Krzysztof Wodiczko with the marc boutin architectural collaborative inc.,"Entuitive Engineering, Calgary","Nemetz (S/A) & Associates Ltd., Calgary","Nemetz (S/A) & Associates Ltd. with Optics Lighting, Calgary","INVIVIA, Cambridge, MA","Traxon Technologies, Ontario",custom detection technology software by INVIVIA,"INVIVIA, Cambridge, MA","The 87m long assembly was conceived as a surface-mounted 'sleeve', fit above the existing concrete infrastructure on both sides of the underpass. The assembly is composed of custom metal fabrications with translucent polycarbonate and glass diffusing surfaces. Materials were selected for the quality in which they reflect, diffuse, or 'catch' light to allow the framework for the lighting to become essential to the experience of the observer. These materials include a reflective aluminum 'exoskeleton' on the public side made of notched and welded 9.5mm aluminum bar stock, an 8mm layer of tempered, laminated safety glass with a translucent interlayer for light diffusion, a 9.5mm thermoformed, translucent polycarbonate geometry, and a supporting galvanized steel subframe surface mounted to the concrete infrastructure of the underpass.","The responsive public art lighting installation is composed of a total of 216 Nano Linear Allegro AC XB RGB LED fixtures and 17,248 individually controlled DOT XL-3 RGB LED fixtures by Traxon Technologies, with half of all fixtures located on each side of the underpass within the protective and performative assembly of custom metal fabrications, polycarbonate and glass. The public art lighting experience is created with a custom detection technology software developed by INVIVIA. This custom software receives video content of pedestrian movement via 4 on-site cameras, analyzes and filters this content, and translates it into the abstracted, colourful representation experienced by visitors to the site.",The DOT XL-3 RGB fixtures located in the installation at the centre of the underpass are provided at a resolution of 9 controllable nodes per square foot.,"This project was implemented as part of The City of Calgary's Centre City Underpass Enhancement Program - a strategy to improve linkages between the city's Downtown and Beltline communities separated by the Canadian Pacific Railway. Though conceived as a mechanism to improve safety and connectivity for its daily commuters, the City's underpasses have ironically come to embody the most uncomfortable of Calgary's public spaces. A 2015 Centre City Perception survey identified Calgary's underpasses as having the lowest rating of all centre city infrastructure for cleanliness and citizen expectation. In 2010, the 2-block stretch of the 4th St SW underpass was identified by The City as a priority for improvement and launched the project in January 2015. Around this time, the underpass was used by approximately 8,100 people daily, accounting for nearly 20% of all pedestrian traffic to the core.",,"YellowCamera, YellowCamera, YellowCamera, YellowCamera, YellowCamera, YellowCamera, YellowCamera, YellowCamera",the marc boutin architectural collaborative inc.,"The City of Calgary, Urban Strategy","The 4th Street SW Underpass Enhancement Project is a result of hundreds of hours of dedicated public engagement, as described within several landmark City of Calgary documents now available on the City of Calgary website: https://engage.calgary.ca/4thStreetSWUnderpass. A significant element of the design process was the continued engagement of internal and external stakeholders. Working closely with the Design Team, interested individuals were offered four critical opportunities to participate in the creative process: identifying issues, finding collective solutions and influencing the project as a process and a product. A full-scale mock-up was completed towards the end of the Design Development phase to demonstrate proof of concept, facilitate owner and stakeholder buy-in, and provide a tool for design research for the future development of the detailed drawings for construction.",,,,,,,The City of Calgary,"the marc boutin architectural collaborative inc., Calgary","Pomerleau with Heavy Industries, Calgary",none,custom wall assembly design by the marc boutin architectural collaborative inc.,"The DOT XL-3 RGB fixtures are organized and mounted to aluminum LED panels, each with 88 dots at a horizontal and vertical pitch of 102mm.",,Dot XL-3 RGB and Nano Linear Allegro AC XB RGB by Traxon Technologies
GREETINGS FROM EVERYWHERE,2021,"Ukraine, Kyiv",Interactive laser installation,"['#Ukraine', '#2021', '#Spatial media art']",https://awards.b-cdn.net/site_media/media/jurysys/media/307/1_big.jpg,https://awards.mediaarchitecture.org/mab/project/307,VISA,,"Gres Todorchuk PR, Expoilight, Ukraine","Mykola Kabluka, Expoilight, Ukraine","Mykola Kabluka, Expoilight, Ukraine","Expoilight, Ukraine","Expoilight, Ukraine",,"Expoilight, Ukraine","Expoilight, Ukraine",,Laser,,,,"Savchenko Yevhenii, Melnikov Oleh, Savchenko Yevhenii, Melnikov Oleh, Savchenko Yevhenii, Melnikov Oleh, Savchenko Yevhenii, Melnikov Oleh, Savchenko Yevhenii, Melnikov Oleh, Savchenko Yevhenii, Melnikov Oleh, Savchenko Yevhenii, Melnikov Oleh, Savchenko Yevhenii, Melnikov Oleh","Gres Todorchuk PR, Ukraine",,,,,,,,,VISA,,,,,,,
DNIPRO LIGHT FLOWER,2020,"Ukraine, Dnipro",Light-Art Installation in the Industrial Zone in Dnipro,"['#Ukraine', '#2020', '#Participatory Media Architecture and Infrastructures']",https://awards.b-cdn.net/site_media/media/jurysys/media/308/1_big.jpg,https://awards.mediaarchitecture.org/mab/project/308,,,"Mykola Kabluka, Expolight, Ukraine","Mykola Kabluka, Expolight, Ukraine","Mykola Kabluka, Expolight, Ukraine","Expolight, Ukraine","Expolight, Ukraine","Expolight, Ukraine","Expolight, Ukraine","Expolight, Ukraine",120 meters high chimney,"The chimney is covered with 700 point light sources, and a 50W laser is installed on the top",,,,"Andrii Bezuglov, Andrii Bezuglov, Andrii Bezuglov, Andrii Bezuglov, Dnipro Light Flower, Dnipro Light Flower","Expolight, Ukraine",,,,,,,,,,,,,,,,
HAMAJA,2020,"Iran, Tehran",Design Your City,"['#Iran', '#2020', '#Spatial media art']",https://awards.b-cdn.net/site_media/media/jurysys/media/311/0_big.jpg,https://awards.mediaarchitecture.org/mab/project/311,"The Bad Department (Media Shokrani, Sahel Minaei, Mahtab Moradi, Sepehr Omidvar)",,"Media Shokrani, Sahel Minaei, Mahtab Moradi, Sepehr Omidvar",,,,,,,,,,,,,"Sahel Minaei, Sahel Minaei, Sahel Minaei, Sahel Minaei, Media Shokrani, Media Shokrani, Media Shokrani, Sepehr Omidvar",,,,,,,,,,,,,,,,,
THE PEARL DIVERS,2019,"United Arab Emirates, Dubai",Dancing with your shadow,"['#United Arab Emirates', '#2019', '#Spatial media art', '#Participatory Media Architecture and Infrastructures']",https://awards.b-cdn.net/site_media/media/jurysys/media/313/2_big_KaN64mi.jpg,https://awards.mediaarchitecture.org/mab/project/313,Emaar,,Daily tous les jours,,,,"Blackmango Productions, Victorine Yok",CEGA,,Daily tous les jours,,,,"In the warmest areas of the world, the sun sets the pace of life. When cities become unlivable because of their scalding concrete, creating shaded areas in public spaces becomes a priority. The Pearl Divers show that another type of urban life is possible whatever the climate.",,"Daily tous les jours, Daily tous les jours, Daily tous les jours, Daily tous les jours, Daily tous les jours",,,"This project was designed to be inclusive of all people. By bringing music in public spaces, The Pearl Divers is an universal invitation to move the body and the mind, across barriers of cultures, languages, ages or origins. It was also designed for the street, a codified place where bodies move in a homogenous way and have little room for spontaneity. In this context, dancing becomes almost political, another universal language for people to feel a sense of freedom while also encouraging self-discovery.",,"After various workshops and public consultations, we learned about the difficult coexistence between humans and the harsh sun in numerous areas of the world. In climates such as Dubaí¯'s, people seek shadows to protect themselves and have less opportunities to enjoy their public spaces. This tension informed our core concept: your own shadow would be the interaction interface to discover the work, embracing their reality.","The Pearl Divers is a permanent installation, embedded in the infrastructure and architecture of the city. It brings a new dimension to the plaza, stimulating the emergence of new gathering habits, and opportunities for people to move together, and take ownership of their public space.",Custom senor and sound software,"MaxMSP, Arduino",,,Studio Dikini,"Atelier B, Atelier Papineau",,,,,
GROW,202021,"Netherlands, Rotterdam",Highlighting the beauty of agriculture.,"['#Netherlands', '#202021', '#More than Human Architecture']",https://awards.b-cdn.net/site_media/media/jurysys/media/314/0_big.jpg,https://awards.mediaarchitecture.org/mab/project/314,Studio Roosegaarde,,Daan Roosegaarde,,,,,,,,"Specifications: 20,000m2 agricultural field with four systems of light recipes on solar batteries for exhibitions worldwide. GROW is precision lighting, focussed horizontally in a controlled area, which can extend the sunlight for a short time and can only be seen from nearby to avoid light pollution. This way GROW is in balance with the environment.",,,,,"Studio Roosegaarde, Studio Roosegaarde, Studio Roosegaarde, Studio Roosegaarde, Studio Roosegaarde, Studio Roosegaarde, Studio Roosegaarde",,GROW is part of the artist-in-residence program of Rabobank.,"With special thanks to Wageningen University & Research, BioLumic and MediaMonks. Photography by Ruben Hamelink and Daan Roosegaarde.",,,,,,,,,,,,,,
