"IN THE AIR, TONIGHT",2014,"Canada, Toronto",Critical Public Data Visualization,"['#Canada', '#2014', '#Participatory Media Architecture and Infrastructures']",https://awards.b-cdn.net/site_media/media/jurysys/media/144/0_big.jpg,https://awards.mediaarchitecture.org/mab/project/144,Ryerson University,Diamond Schmitt Architects,Diamond Schmitt Architects,,Speirs &amp; Major,,,The Light Lab,Pharos,"Miriam Sleeman and Tom Sloan, Control Lighting Ltd","2.5m high x 1.25m wide translucent white glass panes, invisibly joined together to create a continuous, 90m long curved wall surface.","Glass panes are backlit with individually controllable LED fittings capable of mixing and emitting the full RGB spectrum alongside a white light spectrum of 3.0K to 6.0K. The LED fittings distribute light evenly across the glazing, creating a soft and seamless curved appearance with no shadow lines throughout.","370 2.5m high vertical LED fittings (each 48 Watts max) rear illuminate the glazing of the lightwall. Connected in pairs, 185 individually controllable full colour linear 'pixels' are created across the entire length and surface of the glazed wall. The LED fittings provides the ability to produce both beautiful pastel shades as well as intense, saturated colours; all of which can be animated.","The art wall leads into one King's Cross St Pancras Underground station, connecting the station to the entrance level of the David Chipperfield Architect-designed One Pancras Square.","The light wall displays animated ranges of colours sampled from digital images of Kings Cross, hence the name 'pipette'. The colours gently order, shuffle and reorder themselves over the course of the day.",,King's Cross Central Limited Partnership (KCCLP),,,,,,,,,,,,,,50 centimeters,"Medium to low brightness. The illumination from the lightwall subtly augments the ceiling lights in the tunnel. The tunnel is open to pedestrians from Monday-Sunday, 7am until 8pm.",
PIPETTE,2014,"United Kingdom, London",A tapestry of light,"['#United Kingdom', '#2014', '#Spatial media art']",https://awards.b-cdn.net/site_media/media/jurysys/media/145/0_big.jpg,https://awards.mediaarchitecture.org/mab/project/145,King's Cross Central Limited Partnership (KCCLP),Allies and Morrison,Miriam Sleeman and Tom Sloan (for Content on light wall); Speirs &amp; Major (for Conception of light wall),,,,,,Antoine Schmitt,,,Home commputer screen lighting windows from the inside.,All computers are connected and synchronized through internet.,"Neighborhoods, whole cities.","It is a specific, abstract, rhythmic composition. It is generative : it always evolves and never repeats itself.",,,,,,,,,,,,,,,,,,
CITY LIGHTS ORCHESTRA,2015,"France, Strasbourg, Orlí©ans, Mulhouse, Reims, etc..",a participative visual symphony for city windows,"['#France', '#2015', '#Future trends & prototypes']",https://awards.b-cdn.net/site_media/media/jurysys/media/146/0_big.jpg,https://awards.mediaarchitecture.org/mab/project/146,,,Antoine Schmitt,,,,,,,,,,,,,,,,,,,,,,,,,,,,,,
SPINE,2012,"Denmark, Aarhus",Spatial mechanical interactive installation,"['#Denmark', '#2012', '#Spatial media art']",https://awards.b-cdn.net/site_media/media/jurysys/media/147/0_big.jpg,https://awards.mediaarchitecture.org/mab/project/147,,,,,"PIT &amp; CAVI, Aarhus University",,,AHL Lighting Group,,,"Chains of LEDs fixed on a steel frame. Four bands, attached to the railings.",Custom made full color LED lighting chains.,Four low resolution LED bands that wrap around the tower. 8 x ~45 pixels for each side.,"The city hall tower can be seen from almost anywhere in the city. It creates a common reference point, in this case for the state of the city.","PIT &amp; CAVI, Aarhus University",,"PIT &amp; CAVI, Aarhus University",,,,,,,,,,"PIT &amp; CAVI, Aarhus University, and Media Architecture Institute",,,,,,
CITY BUG REPORT,2012,"Denmark, Aarhus",City hall tower with media faíçade,"['#Denmark', '#2012', '#Future trends & prototypes']",https://awards.b-cdn.net/site_media/media/jurysys/media/148/0_big.jpg,https://awards.mediaarchitecture.org/mab/project/148,Aarhus City Hall,,"PIT &amp; CAVI, Aarhus University",,,,,,,,,,,,,,,,,,,,,,,,,,,,,,
MENDELSSOHN EFFEKTORIUM,2014,"Germany, Leipzig",Virtual orchestra for the Mendelssohn-Bartholdy Museum Leipzig,"['#Germany', '#2014', '#Spatial media art']",https://awards.b-cdn.net/site_media/media/jurysys/media/149/0_big.jpg,https://awards.mediaarchitecture.org/mab/project/149,Mendelssohn-Bartholdy Museum Leipzig,,WHITEvoid,,Jean Dubois / Ghyslain Gagnon / Sí©bastien Romprí© / Jean-Philippe Cí´tí© / Katherine Ste-Marie / Sí©bastien Langevin,,,,Madrix,,,"146m of translucent acrylic tubes are lighted by individually controlled RGB LEDs inside the tubes. The semi-opacity of the tube gives the impression a continuous flow of light, with undistinguishable pixels.","The lighting system in laid out as two (both tunnel sides) 3 x 400 pixel matrices. These matrices are controlled by a PC running Madrix software, through 8481 DMX512 channels.","The artwork is installed in the main tunnel between two buildings of École de technologie supí©rieure, one of the largest engineering school in Canada, situated in downtown Montreal.","The system cycles between different patterns: running flows of light through the tubes, alternating solid colors, all with interactive control through sound.",,Ghyslain Gagnon,,,,,,,,,,,,,,5 cm,"The system provides the only lighting source in the tunnel, 24/7, although an emergency auxiliary lighting system can be turned on in case of failure of the artwork.",
LE CIRCUIT DE BACHELARD,2014,"Canada, Montreal",A symbol of the duality between reason and imagination,"['#Canada', '#2014', '#Participatory Media Architecture and Infrastructures']",https://awards.b-cdn.net/site_media/media/jurysys/media/150/0_big.jpg,https://awards.mediaarchitecture.org/mab/project/150,Ecole de technologie supí©rieure,,Jean Dubois / Ghyslain Gagnon,,,,,Martin Professional A/S,Kollision,,,,,"situated along the main river, during the Luminale 2012","Passersby were invited to take part in the festival by manipulating the veil of light via their smartphone, adding an ethereal and vivid tangibility to the building after sundown.",,,,,,,,,,,,,,,,40 mm pixel pitch,,
PHOTOPHORE,2012,"Germany, Frankfurt",Photophore - Smart light interaction,"['#Germany', '#2012', '#Participatory Media Architecture and Infrastructures']",https://awards.b-cdn.net/site_media/media/jurysys/media/151/2_big.jpg,https://awards.mediaarchitecture.org/mab/project/151,,,Katja Winkelmann and Jochen Schröder,,"Francis Krahe &amp; Associates, Inc. - Los Angeles, CA",,,Ecue,Ecue,Traxon Technologies,"The lighting system consists of LED bands, mounted between exterior glass wall mullion.","Reflectorized housings, designed and placed to project lighting effects outward are not visible from within. LED band lengths consistently maintain a maximum gap between fixture and window frame of less than 15mm. The building's unique curvilinear form and multiple window dimensions, required precise calculations and a flexible mounting solution, resulting in a variety of 16 different lengths.","The 10,000 LED units across three towers are controlled by a central computer, project animated graphics across the building skin from mpg or avi file format. More than 25km of data cabling connect individual LED units in a networked array, addressing each 300mm pixel and mapping those points to a central processor, controlling the lighting effects of each tower independently or in unison.",Pre-programmed effects are deployed at specific time intervals to respond to time-of-day as well as to mark culturally significant holidays and celebrations.,"Typically displaying burning flames, the intelligent control system allows for simple lighting show changes for subtle, dynamic artistic expressions and as well as broadcasting of significant local events and messages.",,DIA Holding,,,,,,,,,,HOK Architects,,,,300mm,"LED boards, custom populated with red, green, blue and red, green, amber diodes, provide a full spectrum of color even when viewed through the highly reflective, color-tinted glazing. The resulting system allows for a smooth, fluid animation, enabling the use of any media to be transferred into the projection system.",
BOXLEDS,2010,"Austria, Vienna",Boxes that blink,"['#Austria', '#2010', '#Participatory Media Architecture and Infrastructures']",https://awards.b-cdn.net/site_media/media/jurysys/media/154/1_big.jpg,https://awards.mediaarchitecture.org/mab/project/154,realitylab,,,,,,,,,,,,,,,,,Media Architecture Institute,,,,,,,,,,,,,,,
"ORKHESTRA, ORCHESTRATING THE DEPTH OF LIGHT",2014,"Germany, Frankfurt",None,"['#Germany', '#2014', '#Future trends & prototypes']",https://awards.b-cdn.net/site_media/media/jurysys/media/157/1_big.jpg,https://awards.mediaarchitecture.org/mab/project/157,,,,,,,,,,"UCL: Ana Moutinho, and Ava Fatah. Holition: Shanaka Senevirathne, Chirag Grover and Russell Freeman",The aim is to create new spatial and social narratives and engage people with invisible aspects of their environment through the animated character's movement and behavior.,,"In the Augmented Reality View, the user follows a walking 3D digital character, which guides the user in the exact direction of selected places, following a defined route. The character responds to the users' movements, altering its pose, speed and animation based on the users distance.","the system chooses the shortest path between the user location and the selected places and shows a path over a 2D map. In the AR View the user has the choice to enable or disable a 2D map overlay, registered to the real visualized world",,,"Ava Fatah, The Bartlett, University College London and Jonathan Chippendale, Holition.",,,,,,,,,,,,,,,,
AUGMENTED URBAN REALITY,2014,"United Kingdom, London",Augmented Urban Reality: Arts Trail 2014,"['#United Kingdom', '#2014', '#Future trends & prototypes']",https://awards.b-cdn.net/site_media/media/jurysys/media/158/0_big.jpg,https://awards.mediaarchitecture.org/mab/project/158,University College London in collaboration with Holition Ltd,,University College London in collaboration with Holition Ltd,,,,,,,,The media faíçade at the entrance gates are installed at the inside of the building behind the glass faíçade. Aluminium panels are used to hold the LED pixels.,,,"The Wanda Plaza, as a new landmark of the city of Tangshan, wants to show with this media entrances that it - also at night - has a leading position in the commercial industry.","The media faíçades shows the logo of the Wanda Group. its company name and messages from the group. Also some animations are shown, eg. ocean life.",,,,,,,,,,,,,,,,100 mm,Medium brightness.,
TRAIN STATION FALKENBERG,2013,"Germany, Falkenberg / Elster",Train station Falkenberg,"['#Germany', '#2013', '#Animated Architecture']",https://awards.b-cdn.net/site_media/media/jurysys/media/160/0_big.jpg,https://awards.mediaarchitecture.org/mab/project/160,City of Falkenberg / Elster,Christoph Wagner Architects,Christoph Wagner Architects,,"Motoko Ishii Lighting Design, Japan",,,"Daktronics Inc, USA","Daktronics Inc, USA","Greenhouse Core, China; Nam HyoJun, Korea",Curtain wall with aluminum profiles exterior to the glass faíçade.,Building faíçade: LED linear lighting profiles made at custom length to integrate horizontally in between mullions of the curtain wall. LED linear lighting profiles are attached to the bottom of aluminum fins. Light is transmitted directly from LEDs. Building Outline: LED linear lighting profiles attached to the front and rear sides of the fin that runs the outline of the building.,"Low Resolution -- LED elements are integrated onto the fins of the building. The LEDs do not reflect off the fins or the building. The left and right side building outline are each 3,472 pixels tall and the roof-line is 1,152 pixels wide. There are also 22,432 pixels on the front and rear faces which is symmetrical.",The building can be seen 360 degrees from several kilometers away,"Not intended as an advertising medium, the dynamic faíçade is used to communicate artistic or other impressionistic full-color images to illustrate the building within the skyline.",,China State Construction Engineering Corporation; Shanghai Construction Group,,,,,,,,,,"ALT Cladding, China; Permasteelisa Group, China",,,,62.5mm on LED element; ~4m between horizontal lines of LED elements,Low Brightness: the faíçade is being used from dusk until 10p.m. weeknights; from dusk until 12 p.m. weekends.,
SHANGHAI WORLD FINANCIAL CENTER (SWFC),2013,"China, Shanghai",World's highest dynamic media faíçade.,"['#China', '#2013', '#Animated Architecture']",https://awards.b-cdn.net/site_media/media/jurysys/media/161/0_big.jpg,https://awards.mediaarchitecture.org/mab/project/161,"Mori Building Company, Japan","ECADI, China; Shanghai Modern Architectural Design Company, China","Kohn Pedersen Fox Associates, USA; Irie Miyake Architects and Engineers",,,,,,,,,,,,,,,,,,,,,,,,,,,,,,
NATIONAL LIBRARY,2006,"Belarus, Minsk",A library inside a sparkling diamond,"['#Belarus', '#2006', '#Animated Architecture']",https://awards.b-cdn.net/site_media/media/jurysys/media/169/1_big.jpg,https://awards.mediaarchitecture.org/mab/project/169,Public Building,Victor Karmaenko,,,Claudia Paz Studio,,,"Color Kinetics, Philips","LCE2 FX by e:cue , OSRAM / Video System Engine by Philips CK","Claudia Paz Studio, Nicholas Cheung Studio,Color Burst, Chris Plant (VVVV Programmer)","Composed by three layers, the first is the reflective glass curtain wall, the second is an iron structure that allows to walk between the first and third layer for maintenance. The third consists of 532 iron poles named ""needles"" perpendicular to the faíçade. It is the principle structure of the 3D mesh formed with 2570 units of a custom 10 LED strips. The 3D Mesh formed a 19 x 28 grid.","The faíçade design consists of six layers of LEDs, brighter nodes in the first layer and finer points of light in the next five layers of LEDs. Two deliberate grids; one bright, bold and sparse for dramatic moments, the other concentrated and subtle for nuanced sculptural effects. The content has been designed to take advantage of this optical illusion, producing beautiful interactive effects.","Low resolution- 25.650 RGB pixels, in the first 5 layers, with nodes of 1.5 watts each. The 6th layer has 532 pixels of 25 watts each. This faíçade runs in two modes, interactive and standalone. In both modes, the grid makes organic movements that transforms the faíçade of the building every night.","Situated on a busy junction and visible across the city skyline. It stands out as a visual icon contributing to everyone's experience regardless of their distance. The project is a public artwork intervention that contributes to the wider urban fabric. Such key spaces could become a highlight for the extraordinary, as well as places for social participation.","The different shows provide a canvas for emotional expression and experience. The installation gives people magical powers to create situations that are normally reserved for fantasy. The 'Magic Dust' allows you to throw and push luminescent particles through the faíçade with glittering sound effects. While with 'Rain', you can part the shower of light like with an umbrella. 'Sand' is in an organic manipulation of the faíçade, where shadow and form drift as dunes, followed by the sounds of the wind and shifting sands. 'Stars' provide the remarkable opportunity to dream up your own constellations in the middle of a bright city, each star appearing with an accoustic chime. 'Aurora' provides the opportunity to touch ephemeral strands of plasma, the supernatural becomes tangible together with harmonic resonances. 'Fireworks' provides the opportunity to initiate spontaneous bursts of sparkles and colour, whistling rockets rush upwards in the background with explosions in the foreground. 'Ripple' is a melody of piano notes that generates psychedelic oil drops which collide and mix into new compositions. 'Light Orchestra' transforms the building into a musical instrument of violins and cellos, allowing the public to compose their own symphony.",,Arquileds,,,,,,,,,,Felipe Ferrer Void Arquitects,,,,16.7cm in the vertical and 99cm in the horizontal,"The faíçade is only lit up at night with a specific schedule. Interactive from 6 pm to 10 pm, standalone mode from 10 pm to 1 am. In the weekends the interactive mode could run from 6pm to 1 am. The interactive shows and standalone shows are designed contrasting the high brightness and lower brightness, dimming the lights to create organic effects, shadows and perspective in the content.",
AFFINITY : INTERACTIVE ART INSTALLATION,2014,"Peru, Lima","BCP Affinity is an interactive three dimensional faíçade installation on the Banco de Crí©dito building in Lima, Peru.","['#Peru', '#2014', '#Spatial media art']",https://awards.b-cdn.net/site_media/media/jurysys/media/170/1_big.jpg,https://awards.mediaarchitecture.org/mab/project/170,BCP - Banco de Credito del Peru,Felipe Ferrer -Void Arquitects,"Claudia Paz (Claudia Paz Studio), Cesar Castro (Arquileds), Nicholas Cheung",,,,,,,"concept, iteraction design, iOS application programming: Suse Miessner; Android application programming: Saurabh Pokhrel; openFrameworks applications running on the screens: Suse Miessner",,,,,,,,,,,,,,,,,,,,,,,
URBAN ALPHABETS,2012,"Finland, Helsinki",Urban Alphabets - Experience the city differently,"['#Finland', '#2012', '#Spatial media art']",https://awards.b-cdn.net/site_media/media/jurysys/media/171/0_big.jpg,https://awards.mediaarchitecture.org/mab/project/171,,,Suse Miessner,,"realities:united, Berlin",,,"eCue, eldoLED",realities:united,,Complex 3-dimensional topography made of glass fibre reinforced concrete panels. Total surface area: approx. 1.300mÂ²,1.513 modular LED lights assembled into the faíçade's panels.,"1.314 bowls (i.e.""pixels"") varying in size between 0,10 and 91,7 m2 creating areas of varying resolution",Highly visible from city centre.,,,,,,,,,,,,,Nieto Sobejano Arquitectos in collaboration with realities:united,,,,,"Indirect lighting, use at night only.",
C4 ESPACIO DE CREACIÓN ARTÍSTICA CONTEMPORÁNEA,2012,"Spain, Cordoba",C4 - Building faíçade with an integrated light and media installation,"['#Spain', '#2012', '#Animated Architecture']",https://awards.b-cdn.net/site_media/media/jurysys/media/172/1_big.jpg,https://awards.mediaarchitecture.org/mab/project/172,Junta de Andalusia,"Nieto Sobejano Arquitectos, Madrid",,,anOtherArchitect Berlin in collaboration with Kollision,,,Martin LC Seriesâ„¢ LED panels,,,22m2 of LC Series LED panels were installed on the ceiling of the conference room,,,,"Twitter comments influenced the graphics in real time. The installation was based on a generic software platform that searched for keywords within a tweet and combined it with metadata (tweet-user, time code, geolocation, language, etc.) and then visualized the findings on the basis of a custom real-time graphical engine.",,,,,,,,,,,,,,,,40 mm pixel pitch,"75% during the presentation, 15% during the speakers' talk, and 100% during the break and at the end of the program.",
MARNIX 2000,1999,"Belgium, Brussels",Interactive Matrix,"['#Belgium', '#1999', '#Participatory Media Architecture and Infrastructures']",https://awards.b-cdn.net/site_media/media/jurysys/media/175/0_big.jpg,https://awards.mediaarchitecture.org/mab/project/175,BBL ING,Gordon Bunshaft,,,AHL Lighting,,,AHL Lighting,AHL Lighting,,,,,"The Golden Tower is a commercial building, which constitutes the landmark on ChangAn Street's. With its enormous building faíçade it can create widely seen effects.","The media faíçades shows colourful animations such as fireworks, Christmas trees etc.",,,,,,,,,,,,,,,,300 mm,High brightness,
SUBMERGENCE,2013,"Norway, United Kingdom, New Zealand, Australia, exhibited in Oslo/Geneva/Bristol/Vlissingen/Bremen/Cologne","Submergence, an immersive, walkthrough art installation","['#Norway', '#United Kingdom', '#New Zealand', '#Australia', '#2013', '#Spatial media art']",https://awards.b-cdn.net/site_media/media/jurysys/media/177/1_big.jpg,https://awards.mediaarchitecture.org/mab/project/177,,,"Squidsoup (Anthony Rowe, Gaz Bushell, Chris Bennewith, Liam Birtles, Ollie Bown)",,realities:united,,,SE Lightmanagement AG,"John Dekron, Jeremy Rotsztain/ Mantissa, Ulrike Brückner/ Musterfirma, Peter Castine in collaboration with realities:united",,"Double layer faíçade construction with a non-transparent inner faíçade and an outer ""skin"" constructed from translucent Plexiglas panels covering the biomorphic building. BIX consists of a matrix of conventional circular fluorescent light tubes integrated in the Plexiglas faíçade of the Kunsthaus.",Fluorescent light tubes (custom fixtures),930 pixels on a total surface area of 900m2,Installation is integrated into the building's riverside frontage which faces the city,,,,,,,,,,,,,,,,,,Medium-high; used under twilight conditions and at night,
KUNSTHAUS - BIX,2003,"Austria, Graz",BIX - Communicative Display Skin for the Kunsthaus Graz,"['#Austria', '#2003', '#Animated Architecture']",https://awards.b-cdn.net/site_media/media/jurysys/media/178/0_big.jpg,https://awards.mediaarchitecture.org/mab/project/178,Landesmuseum Joanneum GmbH,Peter Cook &amp; Colin Fournier,,,The Constitute,,,The Constitute,The Constitute,The Constitute,"Plain, yellowish painted wall. outdoor.",A 20.000 ansilumen projector.,,"The building is in the center of Helsinki. The faíçade is situated at a plaza, so people can gather in front of it.",ItÂ´s the first projection on the building.,,The Constitute and connecting cities network,,,,,,,,,,Bees,,,,,Due to the projection only started at dusk.,
HUMAN BEEING,2014,"Finland, Helsinki",Big Bees on Big Buldings,"['#Finland', '#2014', '#Spatial media art']",https://awards.b-cdn.net/site_media/media/jurysys/media/179/0_big.jpg,https://awards.mediaarchitecture.org/mab/project/179,The Constitute,Bees,The Constittute + Connecting Cities Network,,,,,,,,,,,,,,,,,,,,,,,,,,,,,,
FLARE FAÇADE,2008,"Germany,",FLARE creates a dynamic faíçade,"['#Germany', '#2008', '#Future trends & prototypes']",https://awards.b-cdn.net/site_media/media/jurysys/media/180/0_big.jpg,https://awards.mediaarchitecture.org/mab/project/180,,,,,Galaxia Electronics,,,Galaxia Electronics,,,,,,Landmark building with 17 floors,,,,,,,,,,,,,,,,,,,
YTN CENTER,2013,"South Korea, Seoul",Merging media faíçade with ecological planning,"['#South Korea', '#2013', '#Animated Architecture']",https://awards.b-cdn.net/site_media/media/jurysys/media/181/0_big.jpg,https://awards.mediaarchitecture.org/mab/project/181,,Hee-rim,,Alper Derinbogaz,Refik Anadol,,,,vvvv,,Parametric Design + Data Visualization + CNC Cutting,15K Sanyo SD Projectors x 9 VVVV Cinema4D Adobe After Effects,During the night audio/visÄ±ual performance had been projected on the structure which had been accompanied with a generatively designed contemporary aesthetic visuals consisting of input data from the recordins and their transformed versions synchronized to the movement of graphics re-shaping and transforming the structure on which they are projected. The structure in turn influences and transform.,Galatasaray Square near by Taksim Square,6 minutes Audio/Visual Performance,,Refik Anadol,,,,,,,,,,Alper Derinbogaz,,,,(1024x768) x 9 Pixels,15.000 Lumen x 9,
AUGMENTED STRUCTURES V1.1,2011,"Turkey, ISTANBUL",Augmented Structures v1.1 : Acoustic Formations / Istiklal Street,"['#Turkey', '#2011', '#Participatory Media Architecture and Infrastructures']",https://awards.b-cdn.net/site_media/media/jurysys/media/182/0_big.jpg,https://awards.mediaarchitecture.org/mab/project/182,Refik Anadol - Alper Derinbogaz,Alper Derinbogaz,REFIK ANADOL,"Steven Morgan, Rüdiger Ihle",Christopher Bauder,,,,,,,The suspended point cloud particle's positions are calculated with a help of a complex computer algorithm from the viewpoints of the laser projectors and create an impression of random arrangement. This allows the laser beams to reach all spheres without occlusion even deep inside the array. The laser lit spheres form three-dimensional graphics without any sweet or blind spots.,,,Christopher Bauder,,Anna Pilarska,,,,,,,,,,,,,,,,
FLUIDIC,2013,"Italy, Milan",FLUIDIC - Sculpture in Motion,"['#Italy', '#2013', '#Future trends & prototypes']",https://awards.b-cdn.net/site_media/media/jurysys/media/183/0_big.jpg,https://awards.mediaarchitecture.org/mab/project/183,,"Christopher Bauder, Anna Pilarska",WHITEvoid / Christopher Bauder,,,,,Studio Roosegaarde,Studio Roosegaarde,,"Allround faíçade made from flowers, made from several layers of Mylar.",,"Six bright light bulbs are placed onto a moving standard, which can turn 360 degrees, as well as up and down. The lighting is programmed to trace and follow people. If they stand still in one site, the lamp goes up, opening the flowers on the top. When more people interact, the lamp turns wildly.","Placed inside the Marie Madeleine Church in Lille, it can be seen 3 months during festival Lille3000 FANTASTIC.",Studio Roosegaarde,,,,,,,,,,,,,,,,10 centimeter,"Low brightness, from dusk until dawn.",
LOTUS DOME,2012,"France, Lille","Lotus Dome, hundreds of hightech responsive flowers","['#France', '#2012', '#Future trends & prototypes']",https://awards.b-cdn.net/site_media/media/jurysys/media/184/0_big.jpg,https://awards.mediaarchitecture.org/mab/project/184,Studio Roosegaarde,,Studio Roosegaarde,,Studio Roosegaarde,,,,Studio Roosegaarde,,,,,,Studio Roosegaarde,,Studio Roosegaarde,,,,,,,,,,,,,,,,
